{
  "$schema": "https://json-schema.org/draft/2020-12/schema",
  "$id": "https://turbojev.dev/schemas/turbojev.specialization-report.schema.json",
  "title": "TurboJev generic-vs-specialized evaluation report v1",
  "type": "object",
  "additionalProperties": false,
  "required": [
    "contract",
    "id",
    "plan_id",
    "benchmark_suite",
    "comparisons"
  ],
  "properties": {
    "contract": {
      "const": "turbojev.specialization-report.v1"
    },
    "id": {
      "type": "string",
      "minLength": 1
    },
    "plan_id": {
      "type": "string",
      "minLength": 1
    },
    "benchmark_suite": {
      "type": "string",
      "minLength": 1
    },
    "comparisons": {
      "type": "array",
      "minItems": 1,
      "items": {
        "type": "object",
        "additionalProperties": false,
        "required": [
          "pair",
          "generic_run",
          "specialized_run",
          "generic",
          "specialized",
          "delta"
        ],
        "properties": {
          "pair": {
            "type": "object",
            "additionalProperties": false,
            "required": [
              "generic_model",
              "specialized_model"
            ],
            "properties": {
              "generic_model": {
                "type": "string",
                "minLength": 1
              },
              "specialized_model": {
                "type": "string",
                "minLength": 1
              }
            }
          },
          "generic_run": {
            "type": "string",
            "minLength": 1
          },
          "specialized_run": {
            "type": "string",
            "minLength": 1
          },
          "generic": {
            "type": "object",
            "additionalProperties": false,
            "required": [
              "baseline_quality",
              "timing",
              "decisions_per_second",
              "peak_memory_bytes",
              "candidate_order",
              "paraphrase",
              "baseline_observations",
              "variant_observations"
            ],
            "properties": {
              "baseline_quality": {
                "type": "object",
                "additionalProperties": false,
                "required": [
                  "count",
                  "total_weight",
                  "accuracy",
                  "nll",
                  "brier",
                  "ece",
                  "ece_bins"
                ],
                "properties": {
                  "count": {
                    "type": "integer",
                    "minimum": 1
                  },
                  "total_weight": {
                    "type": "number",
                    "exclusiveMinimum": 0
                  },
                  "accuracy": {
                    "type": "number",
                    "minimum": 0,
                    "maximum": 1
                  },
                  "nll": {
                    "type": "number",
                    "minimum": 0
                  },
                  "brier": {
                    "type": "number",
                    "minimum": 0
                  },
                  "ece": {
                    "type": "number",
                    "minimum": 0
                  },
                  "ece_bins": {
                    "type": "array"
                  }
                }
              },
              "timing": {
                "type": "object",
                "additionalProperties": false,
                "required": [
                  "samples",
                  "min_seconds",
                  "median_seconds",
                  "p95_seconds",
                  "max_seconds",
                  "mean_seconds"
                ],
                "properties": {
                  "samples": {
                    "type": "integer",
                    "minimum": 1
                  },
                  "min_seconds": {
                    "type": "number",
                    "minimum": 0
                  },
                  "median_seconds": {
                    "type": "number",
                    "minimum": 0
                  },
                  "p95_seconds": {
                    "type": "number",
                    "minimum": 0
                  },
                  "max_seconds": {
                    "type": "number",
                    "minimum": 0
                  },
                  "mean_seconds": {
                    "type": "number",
                    "minimum": 0
                  }
                }
              },
              "decisions_per_second": {
                "type": "number",
                "exclusiveMinimum": 0
              },
              "peak_memory_bytes": {
                "type": "integer",
                "minimum": 1
              },
              "candidate_order": {
                "type": "object",
                "additionalProperties": false,
                "required": [
                  "count",
                  "total_weight",
                  "invariance",
                  "accuracy"
                ],
                "properties": {
                  "count": {
                    "type": "integer",
                    "minimum": 1
                  },
                  "total_weight": {
                    "type": "number",
                    "exclusiveMinimum": 0
                  },
                  "invariance": {
                    "type": "number",
                    "minimum": 0,
                    "maximum": 1
                  },
                  "accuracy": {
                    "type": "number",
                    "minimum": 0,
                    "maximum": 1
                  }
                }
              },
              "paraphrase": {
                "type": "object",
                "additionalProperties": false,
                "required": [
                  "count",
                  "total_weight",
                  "invariance",
                  "accuracy"
                ],
                "properties": {
                  "count": {
                    "type": "integer",
                    "minimum": 1
                  },
                  "total_weight": {
                    "type": "number",
                    "exclusiveMinimum": 0
                  },
                  "invariance": {
                    "type": "number",
                    "minimum": 0,
                    "maximum": 1
                  },
                  "accuracy": {
                    "type": "number",
                    "minimum": 0,
                    "maximum": 1
                  }
                }
              },
              "baseline_observations": {
                "type": "integer",
                "minimum": 1
              },
              "variant_observations": {
                "type": "integer",
                "minimum": 1
              }
            }
          },
          "specialized": {
            "type": "object",
            "additionalProperties": false,
            "required": [
              "baseline_quality",
              "timing",
              "decisions_per_second",
              "peak_memory_bytes",
              "candidate_order",
              "paraphrase",
              "baseline_observations",
              "variant_observations"
            ],
            "properties": {
              "baseline_quality": {
                "type": "object",
                "additionalProperties": false,
                "required": [
                  "count",
                  "total_weight",
                  "accuracy",
                  "nll",
                  "brier",
                  "ece",
                  "ece_bins"
                ],
                "properties": {
                  "count": {
                    "type": "integer",
                    "minimum": 1
                  },
                  "total_weight": {
                    "type": "number",
                    "exclusiveMinimum": 0
                  },
                  "accuracy": {
                    "type": "number",
                    "minimum": 0,
                    "maximum": 1
                  },
                  "nll": {
                    "type": "number",
                    "minimum": 0
                  },
                  "brier": {
                    "type": "number",
                    "minimum": 0
                  },
                  "ece": {
                    "type": "number",
                    "minimum": 0
                  },
                  "ece_bins": {
                    "type": "array"
                  }
                }
              },
              "timing": {
                "type": "object",
                "additionalProperties": false,
                "required": [
                  "samples",
                  "min_seconds",
                  "median_seconds",
                  "p95_seconds",
                  "max_seconds",
                  "mean_seconds"
                ],
                "properties": {
                  "samples": {
                    "type": "integer",
                    "minimum": 1
                  },
                  "min_seconds": {
                    "type": "number",
                    "minimum": 0
                  },
                  "median_seconds": {
                    "type": "number",
                    "minimum": 0
                  },
                  "p95_seconds": {
                    "type": "number",
                    "minimum": 0
                  },
                  "max_seconds": {
                    "type": "number",
                    "minimum": 0
                  },
                  "mean_seconds": {
                    "type": "number",
                    "minimum": 0
                  }
                }
              },
              "decisions_per_second": {
                "type": "number",
                "exclusiveMinimum": 0
              },
              "peak_memory_bytes": {
                "type": "integer",
                "minimum": 1
              },
              "candidate_order": {
                "type": "object",
                "additionalProperties": false,
                "required": [
                  "count",
                  "total_weight",
                  "invariance",
                  "accuracy"
                ],
                "properties": {
                  "count": {
                    "type": "integer",
                    "minimum": 1
                  },
                  "total_weight": {
                    "type": "number",
                    "exclusiveMinimum": 0
                  },
                  "invariance": {
                    "type": "number",
                    "minimum": 0,
                    "maximum": 1
                  },
                  "accuracy": {
                    "type": "number",
                    "minimum": 0,
                    "maximum": 1
                  }
                }
              },
              "paraphrase": {
                "type": "object",
                "additionalProperties": false,
                "required": [
                  "count",
                  "total_weight",
                  "invariance",
                  "accuracy"
                ],
                "properties": {
                  "count": {
                    "type": "integer",
                    "minimum": 1
                  },
                  "total_weight": {
                    "type": "number",
                    "exclusiveMinimum": 0
                  },
                  "invariance": {
                    "type": "number",
                    "minimum": 0,
                    "maximum": 1
                  },
                  "accuracy": {
                    "type": "number",
                    "minimum": 0,
                    "maximum": 1
                  }
                }
              },
              "baseline_observations": {
                "type": "integer",
                "minimum": 1
              },
              "variant_observations": {
                "type": "integer",
                "minimum": 1
              }
            }
          },
          "delta": {
            "type": "object",
            "additionalProperties": false,
            "required": [
              "accuracy",
              "nll",
              "brier",
              "ece",
              "median_latency_seconds",
              "p95_latency_seconds",
              "decisions_per_second",
              "peak_memory_bytes",
              "candidate_order_invariance",
              "candidate_order_accuracy",
              "paraphrase_invariance",
              "paraphrase_accuracy"
            ],
            "properties": {
              "accuracy": {
                "type": "number"
              },
              "nll": {
                "type": "number"
              },
              "brier": {
                "type": "number"
              },
              "ece": {
                "type": "number"
              },
              "median_latency_seconds": {
                "type": "number"
              },
              "p95_latency_seconds": {
                "type": "number"
              },
              "decisions_per_second": {
                "type": "number"
              },
              "peak_memory_bytes": {
                "type": "number"
              },
              "candidate_order_invariance": {
                "type": "number"
              },
              "candidate_order_accuracy": {
                "type": "number"
              },
              "paraphrase_invariance": {
                "type": "number"
              },
              "paraphrase_accuracy": {
                "type": "number"
              }
            }
          }
        }
      }
    }
  }
}
